[
  {
    "id": "imitation",
    "name": "Imitation",
    "source_url": "https://en.wikipedia.org/wiki/Imitation",
    "summary": "Imitation (from Latin imitatio, \"a copying, imitation\") is a behavior whereby an individual observes and replicates another's behavior. Imitation is also a form of learning that leads to the \"development of traditions, and ultimately our culture. It allows for the transfer of information (behaviors, customs, etc.) between individuals and down generations without the need for genetic inheritance.\" The word imitation can be applied in many contexts, ranging from animal training to politics. The term generally refers to conscious behavior; subconscious imitation is termed mirroring.\n\n\n== Anthropology and social sciences ==\nIn anthropology, some theories hold that all cultures imitate ideas from one of a few original cultures or several cultures whose influence overlaps geographically. Evolutionary diffusion theory holds that cultures influence one another, but that similar ideas can be developed in isolation.\nScholars as well as popular authors have argued that the role of imitation in humans is unique among animals. However, this claim has been recently challenged by scientific research which observed social learning and imitative abilities in animals.\nPsychologist Kenneth Kaye showed that the ability of infants to match the sounds or gestures of an adult depends on an interactive process of turn-taking over many successive trials, in which adults' instinctive behavior plays as great a role as that of the infant. These writers assume that evolution would have selected imitative abilities as fit because those who were good at it had a wider arsenal of learned behavior at their disposal, including tool-making and language.\nHowever, research also suggests that imitative behaviors and other social learning processes are only selected for when outnumbered or accompanied by asocial learning processes: an over-saturation of imitation and imitating individuals leads humans to collectively copy inefficient strategies and evolutionarily maladaptive behaviors, thereby reducing flexibility to new environmental contexts that require adaptation. Research suggests imitative social learning hinders the acquisition of knowledge in novel environments and in situations where asocial learning is faster and more advantageous.\nIn the mid-20th century, social scientists began to study how and why people imitate ideas. Everett Rogers pioneered innovation diffusion studies, identifying factors in adoption and profiles of adopters of ideas. Imitation mechanisms play a central role in both analytical and empirical models of collective human behavior.\n\n\n== Neuroscience ==\nHumans are capable of imitating movements, actions, skills, behaviors, gestures, pantomimes, mimics, vocalizations, sounds, speech, etc. and that we have particular \"imitation systems\" in the brain is old neurological knowledge dating back to Hugo Karl Liepmann. Liepmann's model 1908 \"Das hierarchische Modell der Handlungsplanung\" (the hierarchical model of action planning) is still valid. On studying the cerebral localization of function, Liepmann postulated that planned or commanded actions were prepared in the parietal lobe of the brain's dominant hemisphere, and also frontally. His most important pioneering work is when extensively studying patients with lesions in these brain areas, he discovered that the patients lost (among other things) the ability to imitate. He was the one who coined the term \"apraxia\" and differentiated between ideational and ideomotor apraxia. It is in this basic and wider frame of classical neurological knowledge that the discovery of the mirror neuron has to be seen. Though mirror neurons were first discovered in macaques, their discovery also relates to humans.\nHuman brain studies using functional magnetic resonance imaging (fMRI) revealed a network of regions in the inferior frontal cortex and inferior parietal cortex which are typically activated during imitation tasks. It has been suggested that these regions contain mirror neurons similar to the mirror neurons recorded in the macaque monkey. However, it is not clear if macaques spontaneously imitate each other in the wild.\nNeurologist V. S. Ramachandran argues that the evolution of mirror neurons were important in the human acquisition of complex skills such as language and believes the discovery of mirror neurons to be a most important advance in neuroscience.",
    "fetched_at": "2026-10-21T02:07:05.356274Z"
  },
  {
    "id": "remote-associates-test",
    "name": "Remote Associates Test",
    "source_url": "https://en.wikipedia.org/wiki/Remote_Associates_Test",
    "summary": "The Remote Associates Test (RAT) is a creativity test used to determine a human's creative potential. The test typically lasts forty minutes and consists of thirty to forty questions each of which consists of three common stimulus words that appear to be unrelated.  The subject must think of a fourth word that is somehow related to each of the first three words. Scores are calculated based on the number of correct questions.\n\n\n== Development ==\nThe Remote Associates Test (RAT), adult form was originally published in 1959, and then again in 1962, by Professor Sarnoff Mednick and Martha T. Mednick. In 1971, Mednick and Mednick published the high school form of the RAT. Mednick and Mednick defined the creative thinking process in the test manual as \"the forming of associative elements into new combinations which either meet specified requirements or are in someway useful. The more mutually remote the elements of the new combination, the more creative the process or solution.\" Mednick reported a Spearman-Brown reliability of RAT=0.92 in one sample of students at an Eastern women’s college, and 0.91 in a sample of men tested at the University of Michigan.\n\n\n== Layout ==\nThe two adult forms of the RAT consist of 30 items each. The respondent is allowed 40 minutes to complete the test. Each item provides three stimulus words that are remote from one another; the respondent is then required to find (via the creative process) another word that is a criteria-meeting mediating link, which can be associated with them all in a meaningful way. The test-taker's score is the number correct.\n\n\n=== Example items ===\nSource:\n\n\n=== Compound Remote Associates Test ===\nIn Mednick’s two college-level versions of the test, each consisting of 30 items, each item can be associated with the solution word in a number of ways. For example, the three words same/tennis/head are associated with the solution match by means of synonymy (same = match), formation of a compound (matchhead), and semantics association (tennis match). In 2003, Edward M. Bowden and Mark Jung-Beeman developed 144 compound remote associate problems, a subset of RAT problems, for their studies of insight problem solving. They wanted a greater number of problems than were available in the original RAT, and to present participants with a more consistent task – that the solution word would always be related to the stimulus words in the same way. They designed a set of problems to which the solution word was associated with all three words of the triad through formation of a compound word (or phrase) (e.g., age/mile/sand for the compounds Stone Age, milestone, and sandstone with the solution word stone). Solution words were never repeated or used as problem words; problem words were sometimes repeated. The problems can be divided into two types: homogeneous, for which the solution word is a prefix (or suffix) to all three words of the problem triad, and heterogeneous, for which the solution word is a prefix (or suffix) to at least one of the words of the triad and a suffix (prefix) to the other word(s) of the triad. The 144 problems were scored according to the time required to solve them and to the difficulty ratio. This compound RAT gives researchers a cohesive and operational definition normative list, where subjects are able to solve tasks in less time. The increase in the task solving ratios also provides the test with stronger reliability, but at the price of losing complexity and ending up with a less challenging test, in terms of creativity.\n\n\n==== Example items ====\nSource:\n\n\n== Validity ==\nAccording to Mednick, the RAT could be used to test \"all fields of creative endeavor\" and suggest that those who excel on the RAT will be gifted creatively as well as in the sciences. Mednick also suggested that this test be used to select students from lower-income families to be admitted to special educational programs. However there is no data that shows that students who have done well on the RAT excel in any particular subject leading to criticism of the validity of the RAT. Worthen and Clark (1971) concluded that the RAT measured sensitivity to language rather than creative potential. The correct response is often the most common response and does not link the other three words in any conceptual way.",
    "fetched_at": "2026-10-21T02:08:03.642332Z"
  },
  {
    "id": "impact-bias",
    "name": "Impact bias",
    "source_url": "https://en.wikipedia.org/wiki/Impact_bias",